{
  "plan_id": "plan.week1",
  "pack_revision": "b6a08c79519a501aacfed331ff1cfa1082d28300a60e337e9f402cf600652cae",
  "endpoint_id": "openrouter",
  "model": "nvidia/nemotron-3-ultra-550b-a55b:free",
  "usage": {"prompt_tokens": 900, "completion_tokens": 1500},
  "dispatched": [{"template_id": "prioritize-work", "outcome": "ok"}],
  "candidates": [{"path": "packs/candidates/x.yaml", "hash": "abc123"}]
}
